<?xml version="1.0" encoding="UTF-8"?>
<testdatengenerator belegnummernStart="90000000000"
	datumErsteZiehung="2020-03-28" txBlocksize="200"
	xmlns="http://testdatengenerierung.jpacore.wbs/lotto"
	xmlns:xsi="http://www.w3.org/2001/XMLSchema-instance"
	xsi:schemaLocation="http://testdatengenerierung.jpacore.wbs/lotto testdatengenerator.xsd ">
	<cZiehung spiel77="7777777" super6="666666" superzahl="1"
		zahlenAlsBits="126" anzahlTippsProSchein="2">  <!-- bitmuster berechnen, im tdg z.z. konstant... -->
		<anzahl6Aus49ProGkl>
			<!-- mindestanzahl von scheinen, die in keiner gewinnklasse sind -->
			<anzahl>100</anzahl>  <!-- rausrechnen... -->
			<!-- absolute anzahl von scheinen in den gewinnklassen 1 - 9 -->
			<anzahl>1</anzahl>
			<anzahl>2</anzahl>
			<anzahl>3</anzahl>
			<anzahl>4</anzahl>
			<anzahl>5</anzahl>
			<anzahl>6</anzahl>
			<anzahl>7</anzahl>
			<anzahl>8</anzahl>
			<anzahl>9</anzahl>
		</anzahl6Aus49ProGkl>
		<anzahlSpiel77ProGkl>
			<!-- mindestanzahl von scheinen, die in keiner gewinnklasse sind -->
			<anzahl>100</anzahl>  <!-- rausrechnen... -->
			<!-- absolute anzahl von scheinen in den gewinnklassen 1 - 7 -->
			<anzahl>1</anzahl>
			<anzahl>2</anzahl>
			<anzahl>3</anzahl>
			<anzahl>4</anzahl>
			<anzahl>5</anzahl>
			<anzahl>6</anzahl>
			<anzahl>7</anzahl>
		</anzahlSpiel77ProGkl>
		<anzahlSuper6ProGkl>
			<!-- mindestanzahl von scheinen, die in keiner gewinnklasse sind -->
			<anzahl>100</anzahl>  <!-- rausrechnen... -->
			<!-- absolute anzahl von scheinen in den gewinnklassen 1 - 6 -->
			<anzahl>1</anzahl>
			<anzahl>2</anzahl>
			<anzahl>3</anzahl>
			<anzahl>4</anzahl>
			<anzahl>5</anzahl>
			<anzahl>6</anzahl>
		</anzahlSuper6ProGkl>
	</cZiehung>

	<cZiehung spiel77="7777777" super6="666666" superzahl="1"
		zahlenAlsBits="126" anzahlTippsProSchein="2">  <!-- bitmuster berechnen, im tdg z.z. konstant... -->
		<anzahl6Aus49ProGkl>
			<!-- absolute anzahl von scheinen, die in keiner gewinnklasse sind -->
			<anzahl>100</anzahl>  <!-- rausrechnen... -->
			<!-- absolute anzahl von scheinen in den gewinnklassen 1 - 9 -->
			<anzahl>1</anzahl>
			<anzahl>2</anzahl>
			<anzahl>3</anzahl>
			<anzahl>4</anzahl>
			<anzahl>5</anzahl>
			<anzahl>6</anzahl>
			<anzahl>7</anzahl>
			<anzahl>8</anzahl>
			<anzahl>9</anzahl>
		</anzahl6Aus49ProGkl>
		<anzahlSpiel77ProGkl>
			<!-- absolute anzahl von scheinen, die in keiner gewinnklasse sind -->
			<anzahl>100</anzahl>  <!-- rausrechnen... -->
			<!-- absolute anzahl von scheinen in den gewinnklassen 1 - 7 -->
			<anzahl>1</anzahl>
			<anzahl>2</anzahl>
			<anzahl>3</anzahl>
			<anzahl>4</anzahl>
			<anzahl>5</anzahl>
			<anzahl>6</anzahl>
			<anzahl>7</anzahl>
		</anzahlSpiel77ProGkl>
		<anzahlSuper6ProGkl>
			<!-- absolute anzahl von scheinen, die in keiner gewinnklasse sind -->
			<anzahl>100</anzahl>  <!-- rausrechnen... -->
			<!-- absolute anzahl von scheinen in den gewinnklassen 1 - 6 -->
			<anzahl>1</anzahl>
			<anzahl>2</anzahl>
			<anzahl>3</anzahl>
			<anzahl>4</anzahl>
			<anzahl>5</anzahl>
			<anzahl>6</anzahl>
		</anzahlSuper6ProGkl>
	</cZiehung>

</testdatengenerator>

